{
  "$schema": "./ui.schema.json",
  "version": 1,
  "description": "アプリ枠のユーザー向け文言。字幕本文と記録ファイル形式は含めない。",
  "locales": [
    "ja",
    "en"
  ],
  "fallback": "en",
  "strings": [
    {
      "key": "settings.windowTitle",
      "ja": "Realtime Translator 設定",
      "en": "Realtime Translator Settings"
    },
    {
      "key": "settings.tab.general",
      "ja": "一般",
      "en": "General"
    },
    {
      "key": "settings.tab.speech",
      "ja": "音声認識",
      "en": "Speech recognition"
    },
    {
      "key": "settings.tab.subtitles",
      "ja": "字幕・操作",
      "en": "Subtitles & controls"
    },
    {
      "key": "settings.section.openai",
      "ja": "OpenAI Realtime",
      "en": "OpenAI Realtime"
    },
    {
      "key": "settings.model",
      "ja": "モデル",
      "en": "Model"
    },
    {
      "key": "settings.languagePair",
      "ja": "翻訳方向",
      "en": "Translation direction"
    },
    {
      "key": "settings.subtitleDisplay",
      "ja": "字幕表示",
      "en": "Subtitle display"
    },
    {
      "key": "settings.translatedAudio",
      "ja": "翻訳音声",
      "en": "Translated audio"
    },
    {
      "key": "settings.languagePair.jaEn",
      "ja": "日本語 ↔ 英語",
      "en": "Japanese ↔ English"
    },
    {
      "key": "settings.languagePair.jaEs",
      "ja": "日本語 ↔ スペイン語",
      "en": "Japanese ↔ Spanish"
    },
    {
      "key": "settings.languagePair.enEs",
      "ja": "英語 ↔ スペイン語",
      "en": "English ↔ Spanish"
    },
    {
      "key": "settings.languagePairAppliesNextRecording",
      "ja": "次回録音開始時に反映されます。",
      "en": "Applies the next time you start recording."
    },
    {
      "key": "settings.subtitleDisplayValue",
      "ja": "原文＋翻訳",
      "en": "Source + translation"
    },
    {
      "key": "settings.translatedAudioValue",
      "ja": "字幕のみ（再生なし）",
      "en": "Subtitles only (no playback)"
    },
    {
      "key": "settings.consentToggle",
      "ja": "マイク音声を OpenAI API へ送信することに同意する",
      "en": "I agree to send microphone audio to the OpenAI API"
    },
    {
      "key": "settings.consentHelp",
      "ja": "録音中はマイク音声・原文・訳文が OpenAI へ送信されます。オンライン接続と API 料金が必要です。データ取扱いは OpenAI の Data controls を確認してください。",
      "en": "While recording, microphone audio, source text, and translations are sent to OpenAI. An internet connection and API usage fees are required. Review OpenAI Data controls for how data is handled."
    },
    {
      "key": "settings.save",
      "ja": "保存",
      "en": "Save"
    },
    {
      "key": "settings.delete",
      "ja": "削除",
      "en": "Delete"
    },
    {
      "key": "settings.apiKeySaved.mac",
      "ja": "Keychainに保存済み",
      "en": "Saved in Keychain"
    },
    {
      "key": "settings.apiKeySaved.windows",
      "ja": "資格情報マネージャーに保存済み",
      "en": "Saved in Credential Manager"
    },
    {
      "key": "settings.apiKeyNotSaved",
      "ja": "未保存",
      "en": "Not saved"
    },
    {
      "key": "settings.apiKeySaveOk.mac",
      "ja": "APIキーをKeychainへ保存しました",
      "en": "Saved the API key to Keychain"
    },
    {
      "key": "settings.apiKeySaveOk.windows",
      "ja": "API キーを資格情報マネージャーへ保存しました",
      "en": "Saved the API key to Credential Manager"
    },
    {
      "key": "settings.apiKeySaveFailed",
      "ja": "API キーを保存できませんでした",
      "en": "Could not save the API key"
    },
    {
      "key": "settings.apiKeyDeleteOk",
      "ja": "APIキーを削除しました",
      "en": "Deleted the API key"
    },
    {
      "key": "settings.apiKeyDeleteFailed",
      "ja": "API キーを削除できませんでした",
      "en": "Could not delete the API key"
    },
    {
      "key": "settings.apiKeyStatusUnknown",
      "ja": "API キーの保存状態を確認できませんでした",
      "en": "Could not check whether an API key is saved"
    },
    {
      "key": "settings.apiKeyStorageHelp.mac",
      "ja": "APIキーはKeychainへ保存します。開発ビルドでは環境変数 OPENAI_API_KEY からも自動取り込みできます。",
      "en": "The API key is stored in Keychain. Debug builds can also import it from the OPENAI_API_KEY environment variable."
    },
    {
      "key": "settings.apiKeyStorageHelp.windows",
      "ja": "API キーは Windows 資格情報マネージャーへ保存され、設定ファイルには書き出しません。",
      "en": "The API key is stored in Windows Credential Manager and is not written to the settings file."
    },
    {
      "key": "settings.noiseReduction",
      "ja": "ノイズ低減",
      "en": "Noise reduction"
    },
    {
      "key": "settings.noiseReduction.nearField",
      "ja": "近距離マイク",
      "en": "Near-field mic"
    },
    {
      "key": "settings.noiseReduction.farField",
      "ja": "遠距離マイク",
      "en": "Far-field mic"
    },
    {
      "key": "settings.transcriptionDelay",
      "ja": "認識遅延",
      "en": "Recognition delay"
    },
    {
      "key": "settings.transcriptionDelay.minimal",
      "ja": "最速（精度低め）",
      "en": "Fastest (lower accuracy)"
    },
    {
      "key": "settings.transcriptionDelay.low",
      "ja": "低遅延（既定）",
      "en": "Low delay (default)"
    },
    {
      "key": "settings.transcriptionDelay.medium",
      "ja": "バランス",
      "en": "Balanced"
    },
    {
      "key": "settings.transcriptionDelay.high",
      "ja": "高精度",
      "en": "High accuracy"
    },
    {
      "key": "settings.transcriptionDelay.xhigh",
      "ja": "最高精度",
      "en": "Highest accuracy"
    },
    {
      "key": "settings.delayHelp",
      "ja": "値を上げると短い発話の認識精度が上がり、字幕表示は遅くなります。",
      "en": "Higher values improve recognition of short utterances and delay subtitle display."
    },
    {
      "key": "settings.automaticGain",
      "ja": "マイク音量を自動調整する",
      "en": "Automatically adjust microphone level"
    },
    {
      "key": "settings.automaticGainHelp",
      "ja": "小さな声を聞き取りやすくします。変更は次の録音開始から反映されます。",
      "en": "Makes quiet speech easier to recognize. Changes take effect from the next recording."
    },
    {
      "key": "settings.applyPreset",
      "ja": "プリセットを適用",
      "en": "Apply preset"
    },
    {
      "key": "settings.restoreDefaults",
      "ja": "デフォルトに戻す",
      "en": "Restore defaults"
    },
    {
      "key": "settings.preset.softwareDevelopment",
      "ja": "ソフトウェア開発",
      "en": "Software development"
    },
    {
      "key": "settings.preset.businessMeeting",
      "ja": "ビジネス会議",
      "en": "Business meeting"
    },
    {
      "key": "settings.preset.hackathon",
      "ja": "ハッカソン",
      "en": "Hackathon"
    },
    {
      "key": "settings.section.recognition",
      "ja": "認識設定",
      "en": "Recognition"
    },
    {
      "key": "settings.section.hints",
      "ja": "認識ヒント",
      "en": "Recognition hints"
    },
    {
      "key": "settings.section.subtitles",
      "ja": "字幕",
      "en": "Subtitles"
    },
    {
      "key": "settings.section.controls",
      "ja": "操作",
      "en": "Controls"
    },
    {
      "key": "settings.section.apiKey",
      "ja": "API キー",
      "en": "API key"
    },
    {
      "key": "settings.promptTitle",
      "ja": "認識プロンプト",
      "en": "Recognition prompt"
    },
    {
      "key": "settings.keywordsTitle",
      "ja": "キーワード (1行1語)",
      "en": "Keywords (one word per line)"
    },
    {
      "key": "settings.promptHelp",
      "ja": "会議のテーマや話者、話題を文章で書くと認識精度が上がります。",
      "en": "Writing the meeting topic, speakers, and subject in a sentence improves recognition accuracy."
    },
    {
      "key": "settings.promptCounter",
      "ja": "{count}/{limit} 文字",
      "en": "{count}/{limit} characters"
    },
    {
      "key": "settings.promptOverLimit",
      "ja": "（超過分は切り詰められます）",
      "en": "(excess is truncated)"
    },
    {
      "key": "settings.keywordCounter",
      "ja": "{count}/{limit} 語",
      "en": "{count}/{limit} words"
    },
    {
      "key": "settings.keywordOverLimit",
      "ja": "（超過分は送信されません）",
      "en": "(excess is not sent)"
    },
    {
      "key": "settings.keywordForbidden",
      "ja": "「<」「>」は送信時に自動除去されます。",
      "en": "“<” and “>” are removed automatically when sending."
    },
    {
      "key": "settings.tuningLiveHelp",
      "ja": "プロンプト・キーワード・認識遅延の変更は録音中でも数秒で反映されます。ノイズ低減は次回の録音開始から反映されます。",
      "en": "Prompt, keyword, and recognition-delay changes apply within a few seconds even while recording. Noise reduction applies the next time you start recording."
    },
    {
      "key": "settings.fontSize",
      "ja": "フォントサイズ: {size}pt",
      "en": "Font size: {size}pt"
    },
    {
      "key": "settings.recordSubtitles",
      "ja": "字幕をローカルに記録する",
      "en": "Record subtitles locally"
    },
    {
      "key": "settings.recordSubtitlesHelp.mac",
      "ja": "このMacにのみ保存します。OpenAIへ追加送信しません。メニューから書き出し・クリアできます。",
      "en": "Saved only on this Mac. Not sent to OpenAI. Export or clear from the menu."
    },
    {
      "key": "settings.recordSubtitlesHelp.windows",
      "ja": "この PC にのみ保存します。OpenAI へ追加送信しません。トレイメニューから書き出し・クリアできます。",
      "en": "Saved only on this PC. Not sent to OpenAI. Export or clear from the tray menu."
    },
    {
      "key": "settings.controlsHelp.mac",
      "ja": "メニューバーの開始/停止、または Control + Option + Space を使用します。",
      "en": "Use Start/Stop in the menu bar, or Control + Option + Space."
    },
    {
      "key": "settings.controlsHelp.windows",
      "ja": "タスクトレイのメニュー、または Ctrl + Alt + Space で録音の開始/停止を切り替えます。字幕位置はトレイメニューの「字幕位置を編集」からドラッグで変更できます。",
      "en": "Use the tray menu, or Ctrl + Alt + Space, to start or stop recording. Change subtitle position by dragging from Edit subtitle position in the tray menu."
    },
    {
      "key": "settings.uiLanguage",
      "ja": "表示言語",
      "en": "Display language"
    },
    {
      "key": "settings.uiLanguage.system",
      "ja": "システムと同じ",
      "en": "Match system"
    },
    {
      "key": "settings.uiLanguage.ja",
      "ja": "日本語",
      "en": "Japanese"
    },
    {
      "key": "settings.uiLanguage.en",
      "ja": "English",
      "en": "English"
    },
    {
      "key": "settings.uiLanguageRestartHint",
      "ja": "アプリを再起動すると表示言語が変わります。",
      "en": "The display language changes after you restart the app."
    },
    {